{
  "experiment_id": "EXP-188",
  "record_role": "official",
  "status": "COMPLETED",
  "owner": "fabxoe",
  "issue_number": 188,
  "parent_experiment": "EXP-094",
  "git_commit": "1ff0663af2f682229d715136119e8e1db6bace62",
  "started_at": "2026-08-02T09:37:00.328570+00:00",
  "finished_at": "2026-08-02T09:46:22.197750+00:00",
  "primary_metric": "macro_f1",
  "split_id": "data/splits/stratified_5fold_seed42.csv",
  "folds": [
    {
      "fold": 0,
      "macro_f1": 0.413584295205857,
      "accuracy": 0.3980660757453666,
      "log_loss": 1.8783949012060122,
      "best_iteration": 199,
      "feature_selection": {
        "selector": "phi_jaccard_greedy_mutation_presence_pruner",
        "fold": 0,
        "fit_rows": 4960,
        "parameters": {
          "phi_min": 0.3,
          "jaccard_min": 0.15,
          "min_joint_count": 20
        },
        "mutation_presence_feature_count": 4384,
        "candidate_pair_count": 7,
        "candidate_pairs": [
          {
            "left_gene": "ATRX",
            "right_gene": "IDH1",
            "left_prevalence": 321,
            "right_prevalence": 360,
            "joint_mutation_count": 145,
            "phi": 0.38439979000769425,
            "jaccard": 0.27052238805970147
          },
          {
            "left_gene": "DPYD",
            "right_gene": "SERPING1",
            "left_prevalence": 129,
            "right_prevalence": 53,
            "joint_mutation_count": 27,
            "phi": 0.315666228037565,
            "jaccard": 0.17419354838709677
          },
          {
            "left_gene": "PHF3",
            "right_gene": "RASA2",
            "left_prevalence": 100,
            "right_prevalence": 46,
            "joint_mutation_count": 22,
            "phi": 0.3153441469314561,
            "jaccard": 0.1774193548387097
          },
          {
            "left_gene": "ARHGAP29",
            "right_gene": "CFI",
            "left_prevalence": 72,
            "right_prevalence": 55,
            "joint_mutation_count": 20,
            "phi": 0.3090912346340776,
            "jaccard": 0.18691588785046728
          },
          {
            "left_gene": "MXRA5",
            "right_gene": "PCLO",
            "left_prevalence": 269,
            "right_prevalence": 479,
            "joint_mutation_count": 128,
            "phi": 0.30747606991347703,
            "jaccard": 0.2064516129032258
          },
          {
            "left_gene": "PCLO",
            "right_gene": "RELN",
            "left_prevalence": 479,
            "right_prevalence": 310,
            "joint_mutation_count": 137,
            "phi": 0.3018954063075912,
            "jaccard": 0.21012269938650308
          },
          {
            "left_gene": "ABCA6",
            "right_gene": "CDC5L",
            "left_prevalence": 100,
            "right_prevalence": 50,
            "joint_mutation_count": 22,
            "phi": 0.3014326395740542,
            "jaccard": 0.171875
          }
        ],
        "matched_pair_count": 6,
        "dropped_feature_names": [
          "ATRX__mutated",
          "CDC5L__mutated",
          "CFI__mutated",
          "MXRA5__mutated",
          "RASA2__mutated",
          "SERPING1__mutated"
        ],
        "dropped_gene_names": [
          "ATRX",
          "CDC5L",
          "CFI",
          "MXRA5",
          "RASA2",
          "SERPING1"
        ],
        "matched_pairs": [
          {
            "left_gene": "ATRX",
            "right_gene": "IDH1",
            "left_prevalence": 321,
            "right_prevalence": 360,
            "joint_mutation_count": 145,
            "phi": 0.38439979000769425,
            "jaccard": 0.27052238805970147,
            "dropped_gene": "ATRX"
          },
          {
            "left_gene": "DPYD",
            "right_gene": "SERPING1",
            "left_prevalence": 129,
            "right_prevalence": 53,
            "joint_mutation_count": 27,
            "phi": 0.315666228037565,
            "jaccard": 0.17419354838709677,
            "dropped_gene": "SERPING1"
          },
          {
            "left_gene": "PHF3",
            "right_gene": "RASA2",
            "left_prevalence": 100,
            "right_prevalence": 46,
            "joint_mutation_count": 22,
            "phi": 0.3153441469314561,
            "jaccard": 0.1774193548387097,
            "dropped_gene": "RASA2"
          },
          {
            "left_gene": "ARHGAP29",
            "right_gene": "CFI",
            "left_prevalence": 72,
            "right_prevalence": 55,
            "joint_mutation_count": 20,
            "phi": 0.3090912346340776,
            "jaccard": 0.18691588785046728,
            "dropped_gene": "CFI"
          },
          {
            "left_gene": "MXRA5",
            "right_gene": "PCLO",
            "left_prevalence": 269,
            "right_prevalence": 479,
            "joint_mutation_count": 128,
            "phi": 0.30747606991347703,
            "jaccard": 0.2064516129032258,
            "dropped_gene": "MXRA5"
          },
          {
            "left_gene": "ABCA6",
            "right_gene": "CDC5L",
            "left_prevalence": 100,
            "right_prevalence": 50,
            "joint_mutation_count": 22,
            "phi": 0.3014326395740542,
            "jaccard": 0.171875,
            "dropped_gene": "CDC5L"
          }
        ]
      }
    },
    {
      "fold": 1,
      "macro_f1": 0.4183324058867863,
      "accuracy": 0.3951612903225806,
      "log_loss": 1.8678289991703936,
      "best_iteration": 208,
      "feature_selection": {
        "selector": "phi_jaccard_greedy_mutation_presence_pruner",
        "fold": 1,
        "fit_rows": 4961,
        "parameters": {
          "phi_min": 0.3,
          "jaccard_min": 0.15,
          "min_joint_count": 20
        },
        "mutation_presence_feature_count": 4384,
        "candidate_pair_count": 20,
        "candidate_pairs": [
          {
            "left_gene": "ATRX",
            "right_gene": "IDH1",
            "left_prevalence": 307,
            "right_prevalence": 350,
            "joint_mutation_count": 143,
            "phi": 0.3964268412491516,
            "jaccard": 0.2782101167315175
          },
          {
            "left_gene": "ARFGEF1",
            "right_gene": "RABGAP1",
            "left_prevalence": 112,
            "right_prevalence": 65,
            "joint_mutation_count": 30,
            "phi": 0.34048453235176124,
            "jaccard": 0.20408163265306123
          },
          {
            "left_gene": "NOS1",
            "right_gene": "ROS1",
            "left_prevalence": 170,
            "right_prevalence": 174,
            "joint_mutation_count": 61,
            "phi": 0.331500342813254,
            "jaccard": 0.21554770318021202
          },
          {
            "left_gene": "DNMBP",
            "right_gene": "TGM2",
            "left_prevalence": 89,
            "right_prevalence": 59,
            "joint_mutation_count": 24,
            "phi": 0.3213886746329904,
            "jaccard": 0.1935483870967742
          },
          {
            "left_gene": "ABCA6",
            "right_gene": "CDC5L",
            "left_prevalence": 108,
            "right_prevalence": 49,
            "joint_mutation_count": 24,
            "phi": 0.3203252325749132,
            "jaccard": 0.18045112781954886
          },
          {
            "left_gene": "ERCC5",
            "right_gene": "JAG1",
            "left_prevalence": 64,
            "right_prevalence": 87,
            "joint_mutation_count": 24,
            "phi": 0.31133154580641403,
            "jaccard": 0.1889763779527559
          },
          {
            "left_gene": "AMPH",
            "right_gene": "TAT",
            "left_prevalence": 88,
            "right_prevalence": 49,
            "joint_mutation_count": 21,
            "phi": 0.31085935417902794,
            "jaccard": 0.1810344827586207
          },
          {
            "left_gene": "RNF31",
            "right_gene": "SEMA4D",
            "left_prevalence": 54,
            "right_prevalence": 73,
            "joint_mutation_count": 20,
            "phi": 0.30985655968435827,
            "jaccard": 0.18691588785046728
          },
          {
            "left_gene": "MXRA5",
            "right_gene": "PCLO",
            "left_prevalence": 260,
            "right_prevalence": 466,
            "joint_mutation_count": 124,
            "phi": 0.30873854954171365,
            "jaccard": 0.2059800664451827
          },
          {
            "left_gene": "CLASP1",
            "right_gene": "TGM2",
            "left_prevalence": 81,
            "right_prevalence": 59,
            "joint_mutation_count": 22,
            "phi": 0.30866079826877785,
            "jaccard": 0.1864406779661017
          },
          {
            "left_gene": "ATP8B1",
            "right_gene": "GLDC",
            "left_prevalence": 63,
            "right_prevalence": 70,
            "joint_mutation_count": 21,
            "phi": 0.3069564818618472,
            "jaccard": 0.1875
          },
          {
            "left_gene": "NOS1",
            "right_gene": "SCN10A",
            "left_prevalence": 170,
            "right_prevalence": 223,
            "joint_mutation_count": 65,
            "phi": 0.3067458637544997,
            "jaccard": 0.19817073170731708
          },
          {
            "left_gene": "CYFIP2",
            "right_gene": "HSPH1",
            "left_prevalence": 87,
            "right_prevalence": 51,
            "joint_mutation_count": 21,
            "phi": 0.30609663672070453,
            "jaccard": 0.1794871794871795
          },
          {
            "left_gene": "ATP2C1",
            "right_gene": "TF",
            "left_prevalence": 57,
            "right_prevalence": 71,
            "joint_mutation_count": 20,
            "phi": 0.30550441908892667,
            "jaccard": 0.18518518518518517
          },
          {
            "left_gene": "GP2",